{
  "schemaVersion": 1,
  "sessionSetName": "067-pull-verifier-adapter-experiment-a",
  "pathAwareCritique": "required",
  "critiquedAt": "2026-06-15T12:17:50.977248-04:00",
  "critiques": [
    {
      "provider": "openai",
      "model": "gpt-5.4",
      "verdict": "ISSUES_FOUND",
      "summary": "Reviewed the producer in ai_router/pull_critique.py against the Set 066 gate/validator in ai_router/path_aware_critique.py, the adapter in ai_router/pull_verifier.py, the adapter doc, and ai_router/tests/test_pull_critique.py. The producer does validate-before-write, keys distinctness off the adapter-stamped critique.provider by feeding the stamped critiques into validate_path_aware_critique_artifact, skips failing providers without aborting the others, writes utf-8, and the CLI status/error paths are ASCII-sanitized. I did not find a producer-side bug in the >=2-distinct-provider rule, the recorded-level stamping, or the budget-aware forced-verdict logic in pull_route. I did find one real gate-identity bug: produce_path_aware_critique can write an artifact that validate_path_aware_critique_gate rejects when the set is addressed through a non-canonical path such as '.' or a symlink alias. The tests also miss that gate path entirely, so the existing dot-path test currently blesses the bad case instead of catching it.",
      "findings": [
        {
          "description": "ai_router/pull_critique.py:produce_path_aware_critique resolves session_set_dir before stamping artifact['sessionSetName'] (set_dir = Path(session_set_dir).resolve(); sessionSetName = set_dir.name), but ai_router/path_aware_critique.py:validate_path_aware_critique_gate checks identity against the unresolved basename (expected_name = Path(session_set_dir).name). Because the producer's write guard only checks pathAwareCritique level mismatch, not sessionSetName mismatch, calling the producer with a non-canonical path like '.' / 'foo/.' / a symlink alias can write path-aware-critique.json successfully even though validate_path_aware_critique_gate on that same path will reject it as belonging to the wrong set. This violates the producer's 'refuses to write a gate-failing artifact' guarantee.",
          "severity": "high",
          "category": "correctness"
        },
        {
          "description": "ai_router/tests/test_pull_critique.py does not exercise the actual close-out gate path. test_two_distinct_providers_produces_valid_artifact only calls validate_path_aware_critique_artifact, and test_session_name_resolved_from_dot_invocation asserts produce_path_aware_critique('.') is ok without ever calling validate_path_aware_critique_gate('.'). That omission is why the non-canonical-path identity bug escaped: the current tests verify envelope validity but not gate acceptance under the producer's documented path-handling edge case.",
          "severity": "medium",
          "category": "test-coverage"
        }
      ]
    },
    {
      "provider": "google",
      "model": "gemini-2.5-pro",
      "verdict": "VERIFIED",
      "summary": "The path-aware critique producer (`pull_critique.py`) and its supporting adapter (`pull_verifier.py`) are robustly implemented and well-tested. The producer correctly enforces all critical invariants required by the artifact contract and the close-out gate defined in `path_aware_critique.py`. Key features like the multi-provider check, the gate-identity write guard, graceful handling of provider failures, and correct identity stamping are all present and validated by the test suite. The producer will not write an artifact that the gate would reject, and it correctly assembles and writes artifacts that meet the contract. I found no defects.",
      "findings": []
    }
  ]
}
