{
  "schemaVersion": 1,
  "sessionSetName": "073-cross-target-verification-telemetry",
  "pathAwareCritique": "advisory",
  "critiquedAt": "2026-06-19T20:35:29.993655-04:00",
  "critiques": [
    {
      "provider": "openai",
      "model": "gpt-5.4",
      "verdict": "ISSUES_FOUND",
      "summary": "Reviewed the Set 073 closure artifacts against the workflow/state-file contracts: spec.md, change-log.md, activity-log.json, session-state.json, session-events.jsonl, s2-verification.md, docs/ai-led-session-workflow.md, docs/session-state-schema.md, docs/quick-start.md, and docs/repository-reference.md. The substantive problem is that the set documents itself as closed and fully shipped, but the canonical lifecycle files still say session 2 is in progress and never closed.",
      "findings": [
        {
          "description": "Major contract-drift/completeness issue in docs/session-sets/073-cross-target-verification-telemetry/session-state.json:4-31, session-events.jsonl:6, and change-log.md:79-104. Violation: the repo's own workflow says `change-log.md` is 'Generated after the final session; marks the set as complete' (docs/ai-led-session-workflow.md:231), `status: \"complete\"` means 'change-log.md present and close-out succeeded' (docs/ai-led-session-workflow.md:403-406), and `close_session` 'emits closeout_* events to session-events.jsonl, flips the snapshot to complete/closed on success' (docs/repository-reference.md:526). Impact: a reasonable reviewer should block merge because the set is not actually closed even though the prose claims it is; every tool or human that reads the canonical state will treat Set 073 as still active, which can misbucket the set, suppress final verification metadata, and invite duplicate or conflicting follow-up work. Evidence: change-log.md says Session 2 is 'CLOSED, VERIFIED' and the 'End-of-set deliverables' are 'all shipped' (lines 79 and 104), but session-state.json still has top-level `status: \"in-progress\"`, session 2 `status: \"in-progress\"`, `completedAt: null`, and `verificationVerdict: null`, while session-events.jsonl contains only `work_started` for session 2 and no `closeout_requested`/`closeout_succeeded`. Concrete fix: run the actual session-2 closeout (`close_session`) or otherwise bring the canonical lifecycle artifacts into the closed shape before merging, then regenerate any prose that currently claims the set is already closed.",
          "severity": "Major",
          "category": "contract-drift"
        }
      ]
    },
    {
      "provider": "google",
      "model": "gemini-2.5-pro",
      "verdict": "VERIFIED",
      "summary": "I have reviewed the artifacts for Set 073 Session 1. The review focused on ensuring internal consistency between the telemetry data generated, the analysis of that data, and the final session disposition.\n\nI checked the following:\n1.  Read `platform-run/verification-matrix-report.json` to confirm the raw outputs of the verification run. The claims about the verdicts (GPT-pull `ISSUES_FOUND`, Gemini-pull `VERIFIED`), finding counts (3 vs. 0), and the non-silent nature of the Gemini-pull cell are all accurate.\n2.  Compared the matrix report against `platform-run/remediation-report.json` and `platform-run/remediation-backlog.json` to ensure the findings were aggregated correctly. The consolidation and backlog generation are consistent.\n3.  Read `cross-target-comparison.md` to verify its analysis against the raw JSON data. The telemetry table is accurate, and the key conclusions—Gemini-pull non-silence is replicated, the diff-shape contrast is noted, and the Set 072 meta-finding did not recur—are all directly supported by the evidence in the reports.\n4.  Inspected `s1-issues.json`, which documented a `Minor` overstatement in an earlier draft of `cross-target-comparison.md`. I confirmed that the final version of `cross-target-comparison.md` contains the corrected, more precise language described in the issue's resolution notes.\n5.  Finally, I read `disposition.json` and found its summary to be a faithful and accurate representation of the session's activities and outcomes, including the handling of the Minor verification finding.\n\nAll artifacts are internally consistent, and the claims made in the session summary are well-supported by the evidence on disk. The session correctly identified and fixed a minor documentation issue in its own analysis, demonstrating a robust process. I found no outstanding issues.",
      "findings": []
    }
  ]
}
